Movie Name,Time,Rating,Top 7 Cast,Western,Documentary,Music,TV Movie,War,History,Horror,Romance,Drama,Mystery,Fantasy,Crime,Comedy,Family,Animation,Thriller,Adventure,Science Fiction,Action
Cinderella's Curse (2024),82,61,Kelly Rian SansonCinderella; Chrissie WunnaFairy Godmother; Natasha TosiniEvil Step Sister; Lauren BuddEvil Step Sister; Danielle ScottStepmother; Sam BarrettPrince Levin; Charlotte ColemanThe Queen,0,0,0,0,0,0,1,0,0,0,1,0,0,0,0,0,0,0,0
Deuce Bigalow: Male Gigolo (1999),88,60,"Rob SchneiderDeuce Bigalow; William ForsytheDet. Chuck Fowler; Eddie GriffinTiberius Jefferson ""T.J."" Hicks; Arija BareikisKate; Oded FehrAntoine Laconte; Gail O'GradyClaire; Richard RiehleBob Bigalow",0,0,0,0,0,0,0,0,0,0,0,0,1,0,0,0,0,0,0
Hotel Transylvania 2 (2015),89,68,Adam SandlerDracula (voice); Andy SambergJohnny Loughran (voice); Selena GomezMavis Dracula (voice); Kevin JamesFrankenstein (voice); Steve BuscemiWayne (voice); David SpadeGriffin (voice); Keegan-Michael KeyMurray (voice),0,0,0,0,0,0,0,0,0,0,1,0,1,1,1,0,0,0,0
(500) Days of Summer (2009),95,73,Joseph Gordon-LevittTom; Zooey DeschanelSummer; Geoffrey ArendMcKenzie; Chloë Grace MoretzRachel; Matthew Gray GublerPaul; Clark GreggVance; Patricia BelcherMillie,0,0,0,0,0,0,0,1,1,0,0,0,1,0,0,0,0,0,0
A Minecraft Movie (2025),100,0,Jack BlackSteve; Jason MomoaGarrett Garrison; Emma MyersNatalie; Danielle BrooksDawn; Sebastian Eugene HansenHenry; Jennifer CoolidgeMatt BerryKate McKinnonJemaine ClementValkyraeDanTDMOliver BrotherhoodElizabeth DwyerJessica Bravura,0,0,0,0,0,0,0,0,0,0,1,0,1,1,0,0,1,0,0
Midsommar (2019),147,72,Florence PughDani; Jack ReynorChristian; William Jackson HarperJosh; Will PoulterMark; Vilhelm BlomgrenPelle; Isabelle GrillMaja; Gunnel FredSiv,0,0,0,0,0,0,1,0,1,1,0,0,0,0,0,0,0,0,0
Extraction 2 (2023),122,74,Chris HemsworthTyler Rake; Golshifteh FarahaniNik Khan; Adam BessaYaz Khan; Tornike GogrichianiZurab Radiani / Nikoloz Radiani; Tornike BziavaDavid Radiani; Tinatin (Tina) DalakishviliKetevan Radiani; Andro JaparidzeSandro Radiani,0,0,0,0,0,0,0,0,0,0,0,0,0,0,0,1,0,0,1
Rurouni Kenshin: The Beginning (2021),138,77,Takeru SatohKenshin Himura; Kasumi ArimuraTomoe Yukishiro; Issey TakahashiKogoro Katsura; Nijiro MurakamiSoji Okita; Masanobu AndoShinsaku Takasugi; Kazuki KitamuraTatsumi; Yosuke EguchiHajime Saito,0,0,0,0,0,0,0,1,1,0,0,0,0,0,0,0,1,0,1
Like Water for Chocolate (1992),105,73,Lumi CavazosTita; Regina TornéElena; Ada CarrascoNacha; Marco LeonardiPedro Muzquiz; Mario Iván MartínezDoctor John Brown; Claudette MailléGertrudis; Yareli ArizmendiRosaura,0,0,0,0,0,0,0,1,1,0,0,0,0,0,0,0,0,0,0
The Thing (1982),109,81,Kurt RussellMacReady; Keith DavidChilds; Wilford BrimleyBlair; T.K. CarterNauls; David ClennonPalmer; Richard DysartDr. Copper; Charles HallahanNorris,0,0,0,0,0,0,1,0,0,1,0,0,0,0,0,0,0,1,0
Dumb and Dumber (1994),107,66,Jim CarreyLloyd Christmas; Jeff DanielsHarry Dunne; Lauren HollyMary Swanson; Teri GarrHelen Swanson; Charles RocketNicholas Andre; Karen DuffyJ.P. Shay; Mike StarrJoe Mentaliano,0,0,0,0,0,0,0,0,0,0,0,0,1,0,0,0,0,0,0
Wrong Turn 3: Left for Dead (2009),91,57,Tom FredericNate; Janet MontgomeryAlex; Louise CliffeSophie; Jack GordonTrey; Emma CliffordDeputy Ally Lane; Todd JensenU.S. Marshall; Gil KolirinFloyd,0,0,0,0,0,0,1,0,0,0,0,0,0,0,0,1,0,0,0
Boneyard (2024),96,57,Mel GibsonAgent Petrovick; Nora ZehetnerDetective Young; Gabrielle HaughSelena; 50 CentChief Carter; Brian Van HoltDetective Ortega; Spice Williams-CrosbyDiane Cross; Weston CageCaesar Monto,0,0,0,0,0,0,0,0,0,0,0,0,0,0,0,1,0,0,1
The Human Centipede (First Sequence) (2009),91,52,Dieter LaserDr. Heiter; Ashley C. WilliamsLindsay; Ashlynn YennieJenny; Akihiro KitamuraKatsuro; Andreas LeupoldDetective Kranz; Peter BlankensteinDetective Voller; Rosemary AnnabellaAmy (voice),0,0,0,0,0,0,1,0,0,0,0,0,0,0,0,0,0,0,0
Halloween Ends (2022),111,61,Jamie Lee CurtisLaurie; Andi MatichakAllyson; James Jude CourtneyThe Shape; Rohan CampbellCorey; Will PattonFrank; Jesse C. BoydOfficer Mulaney; Michael BarbieriTerry,0,0,0,0,0,0,1,0,0,0,0,0,0,0,0,1,0,0,0
One Flew Over the Cuckoo's Nest (1975),133,84,Jack NicholsonRandle Patrick McMurphy; Brad DourifBilly Bibbit; Louise FletcherNurse Mildred Ratched; Danny DeVitoMartini; William RedfieldDale Harding; Scatman CrothersOrderly Turkle; Christopher LloydMax Taber,0,0,0,0,0,0,0,0,1,0,0,0,0,0,0,0,0,0,0
Temurun (2024),86,62,Yasamin JasemDewi; Bryan DomaniSena; Karina SuwandiDyah; Kiki NarendraAgung; Jajang C. NoerGayatri; Mian TiaraHesti; Banyu BeningJaka,0,0,0,0,0,0,1,0,0,0,0,0,0,0,0,1,0,0,0
The Mummy Returns (2001),130,64,Brendan FraserRick O'Connell; Rachel WeiszEvelyn O'Connell / Nefertiri; John HannahJonathan Carnahan; Oded FehrArdeth Bay; Arnold VoslooImhotep; Patricia VelásquezMeela / Anck-Su-Namun; Freddie BoathAlex O'Connell,0,0,0,0,0,0,0,0,0,0,1,0,0,0,0,0,1,0,1
Megamind (2010),96,70,Will FerrellMegamind (voice); Tina FeyRoxanne Ritchi (voice); Jonah HillHal Stewart / Tighten (voice); Brad PittMetro Man (voice); David CrossMinion (voice); Justin TherouxMegaminds's Father (voice); Ben StillerBernard (voice),0,0,0,0,0,0,0,0,0,0,0,0,1,1,1,0,0,1,1
Rise of the Planet of the Apes (2011),105,73,Andy SerkisCaesar; James FrancoWill Rodman; Freida PintoCaroline Aranha; John LithgowCharles Rodman; Brian CoxJohn Landon; Tom FeltonDodge Landon; Tyler LabineRobert Franklin,0,0,0,0,0,0,0,0,1,0,0,0,0,0,0,1,0,1,1
Dead Poets Society (1989),128,83,Robin WilliamsJohn Keating; Robert Sean LeonardNeil Perry; Ethan HawkeTodd Anderson; Josh CharlesKnox Overstreet; Gale HansenCharlie Dalton; Dylan KussmanRichard Cameron; Allelon RuggieroSteven Meeks,0,0,0,0,0,0,0,0,1,0,0,0,0,0,0,0,0,0,0
The Call of the Wild (2020),100,76,Harrison FordJohn Thornton; Dan StevensHal; Colin WoodellCharles; Karen GillanMercedes; Omar SyPerreault; Raven ScottPastry Chef; Wes BrownMountie,0,0,0,0,0,0,0,0,1,0,0,0,0,1,0,0,1,0,0
Shooter (2007),124,71,Mark WahlbergBob Lee Swagger; Michael PeñaNick Memphis; Danny GloverColonel Isaac Johnson; Ned BeattySenator Charles F. Meachum; Kate MaraSarah Fenn; Elias KoteasJack Payne; Rhona MitraAlourdes Galindo,0,0,0,0,0,0,0,0,1,0,0,0,0,0,0,1,0,0,1
The Hunger Games: Mockingjay - Part 2 (2015),137,69,Jennifer LawrenceKatniss Everdeen; Josh HutchersonPeeta Mellark; Liam HemsworthGale Hawthorne; Woody HarrelsonHaymitch Abernathy; Elizabeth BanksEffie Trinket; Julianne MoorePresident Alma Coin; Philip Seymour HoffmanPlutarch Heavensbee,0,0,0,0,0,0,0,0,0,0,0,0,0,0,0,0,1,1,1
Pretty Woman (1990),120,75,Richard GereEdward Lewis; Julia RobertsVivian Ward; Jason AlexanderPhilip Stuckey; Ralph BellamyJames Morse; Alex Hyde-WhiteDavid Morse; Laura San GiacomoKit De Luca; Hector ElizondoThe Hotel Manager (Barney Thompson),0,0,0,0,0,0,0,1,0,0,0,0,1,0,0,0,0,0,0
Boiling Point (2021),95,72,Stephen GrahamAndy Jones; Vinette RobinsonCarly; Alice May FeethamBeth; Jason FlemyngAlastair Skye; Hannah WaltersEmily; Malachi KirbyTony; Izuka HoyleCamille,0,0,0,0,0,0,0,0,1,0,0,0,0,0,0,1,0,0,0
A Christmas Carol (1984),101,75,George C. ScottEbenezer Scrooge; Roger ReesFred Holywell / Narrator; David WarnerBob Cratchit; Susannah YorkMrs. Cratchit; Edward WoodwardGhost of Christmas Present; Angela PleasenceGhost of Christmas Past; Michael CarterGhost of Christmas Yet to Come,0,0,0,1,0,0,0,0,1,0,1,0,0,1,0,0,0,0,0
Sherlock Holmes: A Game of Shadows (2011),129,71,Robert Downey Jr.Sherlock Holmes; Jude LawDr. John Watson; Noomi RapaceMadam Simza Heron; Jared HarrisProfessor James Moriarty; Rachel McAdamsIrene Adler; Eddie MarsanInspector Lestrade; Kelly ReillyMary Morstan,0,0,0,0,0,0,0,0,0,1,0,1,0,0,0,0,1,0,1
Nacho Libre (2006),92,65,Jack BlackNacho; Ana de la RegueraSister Encarnación; Héctor JiménezEsqueleto; Darius RoseChancho; Moisés AriasJuan Pablo; Carlos MaycotteSegundo Nuñez; Richard MontoyaGuillermo,0,0,0,0,0,0,0,0,1,0,0,0,1,1,0,0,0,0,0
Five Feet Apart (2019),116,82,Haley Lu RichardsonStella Grant; Cole SprouseWill Newman; Moisés AriasPoe Ramírez; Kimberly Hebert GregoryNurse Barb; Parminder NagraDr. Noor Hamid; Claire ForlaniMeredith; Emily BaldoniJulie,0,0,0,0,0,0,0,1,1,0,0,0,0,0,0,0,0,0,0
A Nightmare on Elm Street (1984),91,73,Heather LangenkampNancy Thompson; Robert EnglundFreddy Krueger; Johnny DeppGlen Lantz; John SaxonLieutenant Thompson; Ronee BlakleyMarge Thompson; Amanda WyssTina Gray; Jsu GarciaRod Lane,0,0,0,0,0,0,1,0,0,0,0,0,0,0,0,0,0,0,0
Maleficent (2014),97,71,Angelina JolieMaleficent; Elle FanningPrincess Aurora; Imelda StauntonKnotgrass; Sharlto CopleyStefan; Lesley ManvilleFlittle; Juno TempleThistletwit; Sam RileyDiaval,0,0,0,0,0,0,0,1,0,0,1,0,0,1,0,0,1,0,1
Hitman (2007),94,61,Timothy OlyphantAgent 47; Dougray ScottMike Whittier; Olga KurylenkoNika Boronina; Robert KnepperYuri Marklov; Ulrich ThomsenMikhail Belicoff; Henry Ian CusickUdre Belicoff; Michael OffeiJenkins,0,0,0,0,0,0,0,0,1,0,0,0,0,0,0,1,0,0,1
Sisu (2022),91,74,Jorma TommilaAatami; Aksel HennieBruno; Jack DoolanWolf; Mimosa WillamoAino; Onni TommilaSchütze; Tatu SinisaloSS Soldier 1; Wilhelm EnckellSS Soldier 3,0,0,0,0,1,0,0,0,0,0,0,0,0,0,0,0,1,0,1
Paddington (2014),96,71,Ben WhishawPaddington (voice); Hugh BonnevilleHenry Brown; Sally HawkinsMary Brown; Madeleine HarrisJudy Brown; Samuel JoslinJonathan Brown; Nicole KidmanMillicent; Julie WaltersMrs. Bird,0,0,0,0,0,0,0,0,0,0,0,0,1,1,0,0,1,0,0
Twister (1996),113,65,Helen HuntJo; Bill PaxtonBill; Jami GertzMelissa; Cary ElwesJonas; Lois SmithAunt Meg; Philip Seymour HoffmanDusty; Alan RuckRabbit,0,0,0,0,0,0,0,0,1,0,0,0,0,0,0,0,1,0,1
Rio (2011),96,67,Jesse EisenbergBlu (voice); Anne HathawayJewel (voice); Leslie MannLinda (voice); Jane LynchAlice / Goose (voice); will.i.amPedro (voice); George LopezRafael (voice); Wanda SykesChloe / Goose (voice),0,0,0,0,0,0,0,0,0,0,0,0,1,1,1,0,1,0,0
Heat (1995),170,79,Al PacinoLt. Vincent Hanna; Robert De NiroNeil McCauley; Val KilmerChris Shiherlis; Jon VoightNate; Tom SizemoreMichael Cheritto; Diane VenoraJustine; Amy BrennemanEady,0,0,0,0,0,0,0,0,1,0,0,1,0,0,0,0,0,0,1
A Good Day to Die Hard (2013),98,53,Bruce WillisJohn McClane; Jai CourtneyJack McClane; Sebastian KochYuri Komarov; Yuliya SnigirIrina Komarov; Sergey KolesnikovViktor Chagarin; Radivoje BukvićAlik; Mary Elizabeth WinsteadLucy McClane,0,0,0,0,0,0,0,0,0,0,0,0,0,0,0,1,0,0,1
Then Came You (2018),97,74,Maisie WilliamsSkye; Asa ButterfieldCalvin; Nina DobrevIzzy; Tyler HoechlinFrank; David KoechnerBob; Peyton ListAshley; Tituss BurgessJulian,0,0,0,0,0,0,0,0,1,0,0,0,1,0,0,0,0,0,0
The Fault in Our Stars (2014),133,76,Shailene WoodleyHazel Grace Lancaster; Ansel ElgortAugustus Waters; Nat WolffIsaac; Laura DernFrannie Lancaster; Sam TrammellMichael Lancaster; Willem DafoePeter van Houten; Lotte VerbeekLidewij Vliegenthart,0,0,0,0,0,0,0,1,1,0,0,0,0,0,0,0,0,0,0
Babylon (2022),189,74,Brad PittJack Conrad; Margot RobbieNellie LaRoy; Diego CalvaManny Torres; Jean SmartElinor St. John; FleaBob Levine; Jovan AdepoSidney Palmer; J.C. CurraisTruck Driver,0,0,0,0,0,0,0,0,1,0,0,0,1,0,0,0,0,0,0
Aladdin (2019),127,71,Will SmithGenie / Mariner; Mena MassoudAladdin; Naomi ScottJasmine; Marwan KenzariJafar; Navid NegahbanSultan; Nasim PedradDalia; Billy MagnussenPrince Anders,0,0,0,0,0,0,0,1,0,0,1,0,0,1,0,0,1,0,0
Nanny McPhee and the Big Bang (2010),109,63,Emma ThompsonNanny McPhee; Asa ButterfieldNorman Green; Ralph FiennesLord Gray; Maggie GyllenhaalIsabel Green; Maggie SmithAgatha Rose Doherty; Rhys IfansPhil Green; Daniel MaysBlenkinsop,0,0,0,0,0,0,0,0,0,0,1,0,1,1,0,0,0,0,0
Upgraded (2024),105,72,Camila MendesAna Santos; Archie RenauxWilliam; Marisa TomeiClaire Dupont; Lena OlinCatherine; Anthony Stewart HeadJulian Marx; Thomas KretschmannArnold Grant; Grégory MontelGerard Abel,0,0,0,0,0,0,0,1,0,0,0,0,1,0,0,0,0,0,0
Percy Jackson & the Olympians: The Lightning Thief (2010),118,62,Logan LermanPercy Jackson; Brandon T. JacksonGrover Underwood; Alexandra DaddarioAnnabeth Chase; Jake AbelLuke Castellan; Pierce BrosnanMr. Brunner / Chiron; Sean BeanZeus; Steve CooganHades,0,0,0,0,0,0,0,0,0,0,1,0,0,1,0,0,1,0,0
F9 (2021),143,71,Vin DieselDominic Toretto; Michelle RodriguezLetty Ortiz; Tyrese GibsonRoman Pearce; LudacrisTej Parker; John CenaJakob Toretto; Nathalie EmmanuelRamsey; Jordana BrewsterMia Toretto,0,0,0,0,0,0,0,0,0,0,0,1,0,0,0,0,1,0,1
Never Back Down (2008),115,68,Sean FarisJake Tyler; Amber HeardBaja Miller; Cam GigandetRyan McCarthy; Djimon HounsouJean Roqua; Evan PetersMax Cooperman; Leslie HopeMargot Tyler; Wyatt SmithCharlie Tyler,0,0,0,0,0,0,0,0,1,0,0,0,0,0,0,0,0,0,1
Non Negotiable (2024),86,61,Mauricio OchmannAlan Bender; Leonardo OrtizgrisVicente; Enoc LeañoPresidente Araiza; Tato AlexanderVictoria; Claudette MailléCarrasco; Gonzalo Vega Jr.Nicolás; Daniel GarciaFajardo,0,0,0,0,0,0,0,0,1,0,0,0,1,0,0,1,0,0,1
Rango (2011),112,69,Johnny DeppRango / Lars (voice); Isla FisherBeans (voice); Ned BeattyMayor (voice); Bill NighyRattlesnake Jake (voice); Abigail BreslinPriscilla (voice); Alfred MolinaRoadkill (voice); Stephen RootDoc / Merrimack / Mr. Snuggles (voice),1,0,0,0,0,0,0,0,0,0,0,0,1,1,1,0,1,0,0
No Strings Attached (2011),107,63,Natalie PortmanEmma Kurtzman; Ashton KutcherAdam Franklin; Kevin KlineAlvin Franklin; Cary ElwesDr. Stephen Metzner; Greta GerwigPatrice; Lake BellLucy; Olivia ThirlbyKatie Kurtzman,0,0,0,0,0,0,0,1,0,0,0,0,1,0,0,0,0,0,0
Anna (2019),119,67,Sasha LussAnna; Helen MirrenOlga; Luke EvansAlex Tchenkov; Cillian MurphyLenny Miller; Lera AbovaMaude; Alexander PetrovPiotr; Nikita PavlenkoVlad,0,0,0,0,0,0,0,0,0,0,0,0,0,0,0,1,1,0,1
Go West (2023),82,46,Sean AstinNarrator; Mallory EvertonCora; Whitney CallRobert Failure Gladstone / Charlotte / Temperance; Matthew MeeseCaptain Evander Lillianquist / Willy / Flour Man / Jeff; Jason GrayChesterton / Doctor / Proprietor / Kit Carson; Natalie MadsenAveline / Madam Molly; Stephen MeekElijah / William / Thirsty Man,1,0,0,0,0,0,0,0,0,0,0,0,1,0,0,0,0,0,0
Box Room (2014),16,53,David Joseph MageeErika McGannKillian CoyleRoxanne JosephineAmanda CoakleySophia ScottConor MarrenRafal Wojtas WolowskiRobert Koczera,0,0,0,0,0,0,1,0,1,0,0,0,0,0,0,0,0,1,0
The Corpse Washer (2024),107,69,Aghniny HaqueLela; Djenar Maesa AyuBu Siti; Ibrahim RisyadArif; Ruth MariniBu Terry; Vonny AnggrainiBu Ana; Mian TiaraBu Tuti; Amara SophieRika,0,0,0,0,0,0,1,0,1,0,0,0,0,0,0,1,0,0,0
Resident Evil: Welcome to Raccoon City (2021),107,60,Kaya ScodelarioClaire Redfield; Hannah John-KamenJill Valentine; Robbie AmellChris Redfield; Tom HopperAlbert Wesker; Avan JogiaLeon Kennedy; Donal LogueChief Irons; Neal McDonoughWilliam Birkin,0,0,0,0,0,0,1,0,0,0,0,0,0,0,0,0,0,1,1
300 (2007),116,72,Gerard ButlerKing Leonidas; Lena HeadeyGorgo; Dominic WestTheron; David WenhamDilios; Vincent ReganCaptain; Michael FassbenderStelios; Tom WisdomAstinos,0,0,0,0,1,0,0,0,0,0,0,0,0,0,0,0,1,0,1
Pearl (2022),102,72,Mia GothPearl; David CorenswetProjectionist; Tandi WrightRuth; Matthew SunderlandFather; Emma Jenkins-PurroMitsy; Alistair SewellHoward; Amelia ReidMargaret,0,0,0,0,0,0,1,0,0,0,0,0,0,0,0,1,0,0,0
13 Hours: The Secret Soldiers of Benghazi (2016),144,73,John KrasinskiJack Silva; James Badge DaleTyrone 'Rone' Woods; Dominic FumusaJohn 'Tig' Tiegen; Max MartiniMark 'Oz' Geist; Pablo SchreiberKris 'Tanto' Paronto; Matt LetscherChris Stevens; Alexia BarlierSona Jillani,0,0,0,0,1,1,0,0,1,0,0,0,0,0,0,0,0,0,1
The Voyeurs (2021),117,66,Sydney SweeneyPippa; Justice SmithThomas; Ben HardySeb; Natasha Liu BordizzoJulia; Katharine King SoAri; Cameo AdeleJoni; Jean YoonDr. Sato,0,0,0,0,0,0,0,0,0,0,0,0,0,0,0,1,0,0,0
Zombieland (2009),88,73,Jesse EisenbergColumbus; Woody HarrelsonTallahassee; Emma StoneWichita; Abigail BreslinLittle Rock; Amber Heard406; Bill MurrayBill Murray; Derek GrafClown Zombie,0,0,0,0,0,0,1,0,0,0,0,0,1,0,0,0,0,0,0
MadS (2024),89,70,Lucille GuillaumeJulia; Laurie PavyAnaïs; Milton RicheRomain; Yovel LewkowskiNoa; Sasha RudakovaWoman on the Road; Vincent PasdermadjianDealer; Jeremiah BourgeoisVoisin,0,0,0,0,0,0,1,0,0,0,0,0,0,0,0,1,0,0,0
S&M Hunter (1986),61,65,Shirō ShimomotoS&M Hunter; Hiromi SaotomeMeg; Yutaka IkejimaDungeon Master; Ayu KiyokawaMachi; Bunmei TobayamaJoe; Naomi SugishitaMaria; Akira FukudaJack,0,0,0,0,0,0,0,0,0,0,0,0,1,0,0,0,0,0,0
Cast Away (2000),143,77,Tom HanksChuck Noland; Helen HuntKelly Frears; Chris NothJerry Lovett; Paul SanchezRamon; Lari WhiteBettina Peterson; Leonid CiterFyodor; David Allen BrooksDick Peterson,0,0,0,0,0,0,0,0,1,0,0,0,0,0,0,0,1,0,0
Runaway Bride (1999),116,61,Julia RobertsMaggie Carpenter; Richard GereIke Graham; Joan CusackPeggy Flemming; Hector ElizondoFisher; Rita WilsonEllie Graham; Paul DooleyWalter Carpenter; Christopher MeloniCoach Bob Kelly,0,0,0,0,0,0,0,1,0,0,0,0,1,0,0,0,0,0,0
The Watchers (2024),102,65,Dakota FanningMina / Lucy; Georgina CampbellCiara; Olwen FouéréMadeline; Oliver FinneganDaniel; Alistair BrammerJohn; John LynchKilmartin; Siobhan HewlettMina's Mother,0,0,0,0,0,0,1,0,0,1,0,0,0,0,0,1,0,0,0
Salt (2010),100,64,Angelina JolieEvelyn Salt; Liev SchreiberTheodore Winter; Chiwetel EjioforDarryl Peabody; Daniel OlbrychskiOleg Vasilyevich Orlov; August DiehlMike Krause; Daniel PearceYoung Orlov; Hunt BlockUS President Howard Lewis,0,0,0,0,0,0,0,0,0,1,0,0,0,0,0,1,0,0,1
P.O. Box Tinto Brass (1995),81,58,Tinto BrassTinto Brass; Cinzia RoccaforteLucia; Cristina RinaldiIvana; Erika SavastaniElena / Michelle (as Erika Saffo); Gaia ZucchiRenata; Carla SolaroFrancesca; Gabriella BarbutiRossella,0,0,0,0,0,0,0,0,0,0,0,0,1,0,0,0,0,0,0
Duchess (2024),113,63,Charlotte KirkScarlett Monaghan / Duchess; Philip WinchesterRobert McNaughton; Colm MeaneyFrank Monaghan; Hoji FortunaBilly Baraka; Stephanie BeachamCharlie; Sean PertweeDanny Oswald; Colin EgglesfieldTom Sullivan,0,0,0,0,0,0,0,0,0,0,0,1,0,0,0,1,0,0,1
National Treasure: Book of Secrets (2007),124,64,Nicolas CageBenjamin Franklin Gates; Diane KrugerAbigail Chase; Justin BarthaRiley Poole; Ed HarrisMitch Wilkinson; Jon VoightPatrick Gates; Helen MirrenEmily Appleton; Harvey KeitelPeter Sadusky,0,0,0,0,0,0,0,0,0,1,0,0,0,0,0,1,1,0,1
Ted (2012),107,64,Mark WahlbergJohn Bennett; Mila KunisLori Collins; Seth MacFarlaneTed (voice); Joel McHaleRex; Giovanni RibisiDonny; Patrick WarburtonGuy; Matt WalshThomas,0,0,0,0,0,0,0,0,0,0,1,0,1,0,0,0,0,0,0
The Matrix Revolutions (2003),129,67,Keanu ReevesNeo; Laurence FishburneMorpheus; Carrie-Anne MossTrinity; Hugo WeavingAgent Smith; Jada Pinkett SmithNiobe; Mary AliceThe Oracle; Harold PerrineauLink,0,0,0,0,0,0,0,0,0,0,0,0,0,0,0,1,1,1,1
"If My Favorite Pop Idol Made It to the Budokan, I Would Die: The Movie (2023)",101,60,Sayuri MatsumuraEripiyo; Himena IreiIchii Maina; Riho NakamuraIgarashi​ Reo; Miu WadaYokota Aya; Momoe MoriMatsuyama Sorane; Kano FujihiraHakata Maki; Yoshida SoyokaMizumori Yumeri,0,0,0,0,0,0,0,0,1,0,0,0,1,0,0,0,0,0,0
In a Violent Nature (2024),94,59,Ry BarrettJohnny; Andrea PavlovicKris; Cameron LoveColt; Reece PresleyThe Ranger; Liam LeoneTroy; Charlotte CreaghanAurora; Lea Rose SebastianisBrodie,0,0,0,0,0,0,1,0,0,0,0,0,0,0,0,1,0,0,0
RRR (2022),185,77,N.T. Rama Rao Jr.Komaram Bheem; Ram CharanAlluri Sitarama Raju; Olivia MorrisJennifer 'Jenny' Buxton; Ray StevensonScott Buxton; Alison DoodyCassandra Buxton; Ajay DevgnAlluri Venkatarama Raju; Alia BhattSita,0,0,0,0,0,0,0,0,1,0,0,0,0,0,0,0,0,0,1
The Revenant (2015),157,75,Leonardo DiCaprioHugh Glass; Tom HardyJohn Fitzgerald; Domhnall GleesonCaptain Andrew Henry; Will PoulterJim Bridger; Forrest GoodluckHawk; Duane HowardElk Dog; Arthur RedCloudHikuc,1,0,0,0,0,0,0,0,1,0,0,0,0,0,0,0,1,0,0
Grease (1978),110,74,Olivia Newton-JohnSandy Olsson; John TravoltaDanny Zuko; Stockard ChanningBetty Rizzo; Jeff ConawayKenickie Murdoch; Barry PearlDoody; Michael TucciSonny; Kelly WardPutzie,0,0,0,0,0,0,0,1,0,0,0,0,1,0,0,0,0,0,0
Night Shift (2023),27,60,Valentino NaughtonConserje; Dana Carolina GorgoneMiche; Irune PorcelChica de pollera y camisa; Gimena CosChica de negro; Pablo PintoAlfredo Segovia; Nicolás SchneiderÁngel Gutiérrez; Beatriz DellacasaClelia,0,0,0,0,0,0,0,0,0,0,0,1,1,0,0,1,0,0,0
Edward Scissorhands (1990),105,77,Johnny DeppEdward Scissorhands; Winona RyderKim; Dianne WiestPeg; Anthony Michael HallJim; Kathy BakerJoyce; Robert OliveriKevin; Conchata FerrellHelen,0,0,0,0,0,0,0,1,1,0,1,0,0,0,0,0,0,0,0
Sex Tape (2014),94,54,Cameron DiazAnnie; Jason SegelJay; Rob CorddryRobby; Ellie KemperTess; Rob LoweHank; Jolene BlalockCatalina; Melissa PauloRosie,0,0,0,0,0,0,0,0,0,0,0,0,1,0,0,0,0,0,0
Robot Dreams (2023),102,80,Ivan LabandaDog / Robot / Various (voice); Tito TrifolVarious (voice); Rafa CalvoVarious (voice); José García TosVarious (voice); José Luis MediavillaVarious (voice); Graciela MolinaDuck / Various (voice); Esther SolansVarious (voice),0,0,0,0,0,0,0,0,1,0,0,0,1,0,1,0,0,1,0
Upgrade (2018),100,75,Logan Marshall-GreenGrey Trace; Betty GabrielDetective Cortez; Harrison GilbertsonEron Keen; Melanie VallejoAsha Trace; Benedict HardieFisk; Linda CropperPamela; Simon MaidenStem (voice),0,0,0,0,0,0,0,0,0,0,0,0,0,0,0,1,0,1,1
Out of Exile (2023),107,65,Adam HamptonGabriel Russell; Karrie CoxAgent Jordan; Kyle Jacob HenryWesley Russell; Ryan MerrimanAgent Brett Solomon; Peter GreeneWhitman Rader; Hayley McFarlandDawn Russell; Aurelian Smith Jr.Remy,0,0,0,0,0,0,0,0,1,0,0,1,0,0,0,1,0,0,1
Donnie Darko (2001),114,78,Jake GyllenhaalDonnie Darko; Jena MaloneGretchen Ross; James DuvalFrank; Drew BarrymoreKaren Pomeroy; Beth GrantKitty Farmer; Maggie GyllenhaalElizabeth Darko; Mary McDonnellRose Darko,0,0,0,0,0,0,0,0,1,1,1,0,0,0,0,0,0,0,0
Padre no hay más que uno 4: Campanas de boda (2024),99,70,Santiago SeguraJavier; Toni AcostaMarisa; Leo HarlemPaco; Carlos IglesiasAbuelo Agustín; Silvia AbrilCarmen; Loles LeónAbuela Milagros; El CejasOcho,0,0,0,0,0,0,0,0,0,0,0,0,1,1,0,0,0,0,0
The Purge (2013),86,63,Ethan HawkeJames Sandin; Lena HeadeyMary Sandin; Max BurkholderCharlie Sandin; Adelaide KaneZoey Sandin; Edwin HodgeBloody Stranger; Rhys WakefieldPolite Leader; Tony OllerHenry,0,0,0,0,0,0,1,0,0,0,0,0,0,0,0,1,0,1,0
Carl's Date (2023),9,75,Ed AsnerCarl (voice); Bob PetersonDug / Alpha (voice); ,0,0,0,0,0,0,0,0,0,0,0,0,1,1,1,0,1,0,0
Green Book (2018),130,82,Viggo MortensenTony Lip; Mahershala AliDr. Don Shirley; Linda CardelliniDolores; Sebastian ManiscalcoJohnny Venere; Dimiter D. MarinovOleg; P.J. ByrneRecord Exec; Mike HattonGeorge,0,0,0,0,0,1,0,0,1,0,0,0,0,0,0,0,0,0,0
Daddy's Head (2024),92,61,Julia BrownLaura; Nathaniel Martello-WhiteRobert; Charles AitkenJames; Mary WoodvineMary; Rupert TurnbullIsaac; Kaisa HammarlundMiranda; Deepica StephenSaanvi,0,0,0,0,0,0,1,0,0,0,0,0,0,0,0,0,0,0,0
The Matrix Resurrections (2021),147,64,Keanu ReevesNeo / Thomas Anderson; Carrie-Anne MossTrinity / Tiffany; Yahya Abdul-Mateen IIMorpheus / Agent Smith; Jonathan GroffSmith; Jessica HenwickBugs; Neil Patrick HarrisThe Analyst; Jada Pinkett SmithNiobe,0,0,0,0,0,0,0,0,0,0,0,0,0,0,0,0,1,1,1
Shaun of the Dead (2004),99,75,Simon PeggShaun; Nick FrostEd; Kate AshfieldLiz; Lucy DavisDianne; Dylan MoranDavid; Penelope WiltonBarbara; Bill NighyPhillip,0,0,0,0,0,0,1,0,0,0,0,0,1,0,0,0,0,0,0
It Follows (2015),101,66,Maika MonroeJay Height; Keir GilchristPaul; Daniel ZovattoGreg Hannigan; Jake WearyHugh; Olivia LuccardiYara; Lili SepeKelly Height; Bailey SpryAnnie,0,0,0,0,0,0,1,0,0,1,0,0,0,0,0,0,0,0,0
Wrath of the Titans (2012),99,57,Sam WorthingtonPerseus; Liam NeesonZeus; Ralph FiennesHades; Rosamund PikeAndromeda; Bill NighyHephaestus; Edgar RamírezAres; Toby KebbellArgenor,0,0,0,0,0,0,0,0,0,0,1,0,0,0,0,0,1,0,1
Sully (2016),96,72,Tom HanksChesley 'Sully' Sullenberger; Aaron EckhartJeff Skiles; Laura LinneyLorraine Sullenberger; Anna GunnElizabeth Davis; Autumn ReeserTess Soza; Holt McCallanyMike Cleary; Mike O'MalleyCharles Porter,0,0,0,0,0,1,0,0,1,0,0,0,0,0,0,0,0,0,0
To Be Twenty (1978),94,58,Gloria GuidaLia; Lilli CaratiTina; Ray LovelockRico; Vincenzo CrocittiRiccetto; Giorgio BracardiCommissario Maresciallo Zambo; Leopoldo MastelloniArguinas; Roberto RealeLeader of Delinquents,0,0,0,0,0,0,0,0,0,0,0,0,1,0,0,0,0,0,0
Uglies (2024),100,59,Joey KingTally; Brianne TjuShay; Keith PowersDavid; Chase StokesPeris; Laverne CoxDr. Cable; Charmin LeeMaddy; Jay DeVon JohnsonAz,0,0,0,0,0,0,0,0,0,0,0,0,0,0,0,0,1,1,1
A Silent Voice: The Movie (2016),129,84,Miyu IrinoShouya Ishida (voice); Saori HayamiShouko Nishimiya (voice); Aoi YukiYuzuru Nishimiya (voice); Kensho OnoTomohiro Nagatsuka (voice); Yuki KanekoNaoka Ueno (voice); Yui IshikawaMiyoko Sahara (voice); Megumi HanMiki Kawai (voice),0,0,0,0,0,0,0,0,1,0,0,0,0,0,1,0,0,0,0
Blade (1998),121,68,Wesley SnipesBlade; Stephen DorffDeacon Frost; Kris KristoffersonWhistler; N'Bushe WrightKaren; Donal LogueQuinn; Udo KierDragonetti; Arly JoverMercury,0,0,0,0,0,0,1,0,0,0,0,0,0,0,0,0,0,0,1
To All the Boys I've Loved Before (2018),100,76,"Lana CondorLara Jean Song Covey; Noah CentineoPeter Kavinsky; Janel ParrishMargot Song Covey; Anna CathcartKatherine ""Kitty"" Song Covey; Andrew BachelorGreg Rivera; Trezzo MahoroLucas James; Emilija BaranacGenevieve",0,0,0,0,0,0,0,1,0,0,0,0,1,0,0,0,0,0,0
Contact (1997),150,74,Jodie FosterEllie Arroway; Matthew McConaugheyPalmer Joss; James WoodsMichael Kitz; John HurtS. R. Hadden; Tom SkerrittDavid Drumlin; William FichtnerKent; David MorseTed Arroway,0,0,0,0,0,0,0,0,1,1,0,0,0,0,0,0,0,1,0
Kill Bill: Vol. 1 (2003),111,80,Uma ThurmanThe Bride; Lucy LiuO-Ren Ishii; Vivica A. FoxVernita Green; Daryl HannahElle Driver; David CarradineBill; Michael MadsenBudd; Julie DreyfusSofie Fatale,0,0,0,0,0,0,0,0,0,0,0,1,0,0,0,0,0,0,1
Cloudy with a Chance of Meatballs (2009),90,66,"Bill HaderFlint Lockwood (voice); Anna FarisSam Sparks (voice); James CaanTim Lockwood (voice); Andy Samberg""Baby"" Brent (voice); Bruce CampbellMayor Shelbourne (voice); Mr. TEarl Devereaux (voice); Bobb'e J. ThompsonCal Devereaux (voice)",0,0,0,0,0,0,0,0,0,0,0,0,1,1,1,0,0,0,0
