Movie Name,Time,Rating,Top 7 Cast,Western,Documentary,Music,TV Movie,War,History,Horror,Romance,Drama,Mystery,Fantasy,Crime,Comedy,Family,Animation,Thriller,Adventure,Science Fiction,Action
Pacific Rim (2013),131,69,Charlie HunnamRaleigh Becket; Rinko KikuchiMako Mori; Idris ElbaStacker Pentecost; Max MartiniHerc Hansen; Clifton Collins Jr.Tendo Choi; Ron PerlmanHannibal Chau; Charlie DayDr. Newton Geiszler,0,0,0,0,0,0,0,0,0,0,0,0,0,0,0,0,1,1,1
Hot Frosty (2024),90,60,Lacey ChabertKathy; Dustin MilliganJack; Craig RobinsonSheriff Hunter; Joe Lo TruglioDeputy Sheriff Schatz; Katy MixonDottie; Lauren HollyJane; Chrishell StauseJan,0,0,0,0,0,0,0,1,0,0,0,0,1,0,0,0,0,0,0
Leggings Mania (2023),99,50,JamesYong-soo; Im Cho-heeJeong-hee; Im Tae-mokByeong-min; Do HeeDam-hoi; ,0,0,0,0,0,0,0,1,1,0,0,0,0,0,0,0,0,0,0
The Truman Show (1998),103,81,Jim CarreyTruman Burbank; Laura LinneyMeryl Burbank / Hannah Gill; Noah EmmerichMarlon / Louis Coltrane; Natascha McElhoneLauren Garland / Sylvia; Holland TaylorAngela Montclair / Alanis Montclair; Ed HarrisChristof; Paul GiamattiSimeon,0,0,0,0,0,0,0,0,1,0,0,0,1,0,0,0,0,0,0
Scream VI (2023),123,70,Melissa BarreraSam Carpenter; Jenna OrtegaTara Carpenter; Jasmin Savoy BrownMindy Meeks-Martin; Mason GoodingChad Meeks-Martin; Jack ChampionEthan Landry; Roger L. Jackson'The Voice' (voice); Liana LiberatoQuinn Bailey,0,0,0,0,0,0,1,0,0,0,0,1,0,0,0,1,0,0,0
Van Helsing (2004),132,64,Hugh JackmanVan Helsing; Kate BeckinsaleAnna Valerious; Richard RoxburghCount Vladislaus Dracula; David WenhamCarl; Shuler HensleyFrankenstein's Monster; Elena AnayaAleera; Will KempVelkan,0,0,0,0,0,0,1,0,0,0,0,0,0,0,0,0,1,0,1
Grown Ups 2 (2013),101,61,Adam SandlerLenny Feder; Kevin JamesEric Lamonsoff; Chris RockKurt McKenzie; David SpadeMarcus Higgins; Salma Hayek PinaultRoxanne Chase-Feder; Maya RudolphDeanne McKenzie; Maria BelloSally Lamonsoff,0,0,0,0,0,0,0,0,0,0,0,0,1,0,0,0,0,0,0
The Family Plan (2023),118,73,Mark WahlbergDan Morgan; Michelle MonaghanJessica Morgan; Maggie QGwen; Zoe CollettiNina Morgan; Van CrosbyKyle Morgan; Ciarán HindsMcCaffrey; Kellen BoyleCyrus,0,0,0,0,0,0,0,0,0,0,0,0,1,0,0,0,0,0,1
Poor Things (2023),141,77,Emma StoneBella Baxter; Mark RuffaloDuncan Wedderburn; Willem DafoeGodwin Baxter; Ramy YoussefMax McCandles; Christopher AbbottAlfie Blessington; Suzy BembaToinette; Jerrod CarmichaelHarry Astley,0,0,0,0,0,0,0,1,0,0,0,0,1,0,0,0,0,1,0
Fall (2022),102,72,Grace Caroline CurreyBecky Connor; Virginia GardnerShiloh Hunter; Jeffrey Dean MorganJames Conner; Mason GoodingDan Connor; Jasper ColeSteve; Darrell DennisRandy; Julia Pace MitchellDiner Server,0,0,0,0,0,0,0,0,0,0,0,0,0,0,0,1,0,0,0
It's a Wonderful Life (1946),130,83,James StewartGeorge Bailey; Donna ReedMary Hatch; Lionel BarrymoreMr. Potter; Thomas MitchellUncle Billy; Henry TraversClarence; Beulah BondiMrs. Bailey; Frank FaylenErnie,0,0,0,0,0,0,0,0,1,0,1,0,0,1,0,0,0,0,0
Beauty and the Beast (1991),84,77,Paige O'HaraBelle (voice); Robby BensonBeast (voice); Richard WhiteGaston (voice); Jerry OrbachLumiere (voice); David Ogden StiersCogsworth (voice); Angela LansburyMrs. Potts (voice); Rex EverhartMaurice (voice),0,0,0,0,0,0,0,1,0,0,1,0,0,1,1,0,0,0,0
Gran Turismo (2023),135,78,Archie MadekweJann Mardenborough; David HarbourJack Salter; Orlando BloomDanny Moore; Djimon HounsouSteve Mardenborough; Darren BarnetMatty Davis; Maeve Courtier-LilleyAudrey; Geri HalliwellLesley Mardenborough,0,0,0,0,0,0,0,0,1,0,0,0,0,0,0,0,1,0,1
Scarface (1983),169,82,Al PacinoTony Montana; Steven BauerManny Ray; Michelle PfeifferElvira; Mary Elizabeth MastrantonioGina; Robert LoggiaFrank Lopez; Miriam ColonMama Montana; F. Murray AbrahamOmar,0,0,0,0,0,0,0,0,1,0,0,1,0,0,0,0,0,0,1
Constantine (2005),121,71,Keanu ReevesJohn Constantine; Rachel WeiszAngela Dodson / Isabel Dodson; Shia LaBeoufChas Kramer; Djimon HounsouMidnite; Max BakerBeeman; Pruitt Taylor VinceFather Hennessy; Gavin RossdaleBalthazar,0,0,0,0,0,0,1,0,0,0,1,0,0,0,0,0,0,0,1
Toy Story 3 (2010),103,78,Tom HanksWoody (voice); Tim AllenBuzz Lightyear (voice); Joan CusackJessie (voice); Don RicklesMr. Potato Head (voice); Wallace ShawnRex (voice); John RatzenbergerHamm (voice); Estelle HarrisMrs. Potato Head (voice),0,0,0,0,0,0,0,0,0,0,0,0,1,1,1,0,0,0,0
Kung Fu Panda (2008),90,73,Jack BlackPo (voice); Angelina JolieTigress (voice); Dustin HoffmanShifu (voice); Ian McShaneTai Lung (voice); Jackie ChanMonkey (voice); Lucy LiuViper (voice); Seth RogenMantis (voice),0,0,0,0,0,0,0,0,0,0,0,0,1,1,1,0,1,0,1
Prey (2022),100,77,Amber MidthunderNaru; Dakota BeaversTaabe; Michelle ThrushAruka; Stormee KippWasape; Julian Black AntelopeChief Kehetu; Dane DiLiegroPredator; Stefany MathiasSumu (Chief Wife),0,0,0,0,0,0,0,0,0,0,0,0,0,0,0,1,0,1,1
Through My Window: Across the Sea (2023),110,66,Clara GalleRaquel; Julio PeñaAres Hidalgo; Guillermo LasherasYoshi; Natalia AzaharaDaniela; Hugo ArbuesApolo Hidalgo; Eric MasipArtemis Hidalgo; Andrea ChaparroVera,0,0,0,0,0,0,0,1,1,0,0,0,1,0,0,0,0,0,0
Eternal Sunshine of the Spotless Mind (2004),108,81,Jim CarreyJoel Barish; Kate WinsletClementine Kruczynski; Kirsten DunstMary; Mark RuffaloStan; Elijah WoodPatrick; Tom WilkinsonDr. Mierzwiak; Jane AdamsCarrie,0,0,0,0,0,0,0,1,1,0,0,0,0,0,0,0,0,1,0
American Sniper (2014),133,74,Bradley CooperChris Kyle; Sienna MillerTaya Renae Kyle; Kyle GallnerGoat-Winston; Cole KonisYoung Chris Kyle; Ben ReedWayne Kyle; Elise RobertsonDebbie Kyle; Keir O'DonnellJeff Kyle,0,0,0,0,1,0,0,0,0,0,0,0,0,0,0,0,0,0,1
Pushpa: The Rise (2021),179,70,Allu ArjunPushpa Raj; Rashmika MandannaSrivalli; Jagadeesh BandariKesava; Sunil VarmaMangalam Srinu; Anasuya BharadwajDakshayani; DhananjayJolly Reddy; Ajay GhoshKonda Reddy,0,0,0,0,0,0,0,0,1,0,0,0,0,0,0,1,0,0,1
The Incredibles (2004),115,77,Craig T. NelsonBob Parr / Mr. Incredible (voice); Holly HunterHelen Parr / Elastigirl (voice); Sarah VowellViolet Parr (voice); Spencer FoxDashiell 'Dash' Parr (voice); Jason LeeBuddy Pine / Syndrome (voice); Samuel L. JacksonLucius Best / Frozone (voice); Elizabeth PeñaMirage (voice),0,0,0,0,0,0,0,0,0,0,0,0,0,1,1,0,1,0,1
Queer (2024),138,68,Daniel CraigWilliam Lee; Drew StarkeyEugene Allerton; Jason SchwartzmanJoe; Lesley ManvilleDoctor Cotter; Henry ZagaWinston Moor; Drew DroegeJohn Dume; Omar ApolloChimu Bar Guy,0,0,0,0,0,0,0,1,1,0,0,0,0,0,0,0,0,0,0
The Green Mile (1999),189,85,Tom HanksPaul Edgecomb; David MorseBrutus 'Brutal' Howell; Bonnie HuntJan Edgecomb; Michael Clarke DuncanJohn Coffey; James CromwellWarden Hal Moores; Michael JeterEduard Delacroix; Graham GreeneArlen Bitterbuck,0,0,0,0,0,0,0,0,1,0,1,1,0,0,0,0,0,0,0
Shutter Island (2010),138,82,Leonardo DiCaprioTeddy Daniels; Mark RuffaloChuck Aule; Ben KingsleyDr. Cawley; Max von SydowDr. Naehring; Michelle WilliamsDolores; Emily MortimerRachel 1; Patricia ClarksonRachel 2,0,0,0,0,0,0,0,0,1,1,0,0,0,0,0,1,0,0,0
Jigra (2024),155,58,Alia BhattSatyabha 'Satya' Anand; Vedang RainaAnkur Anand; Manoj PahwaShekhar Bhatia; Vivek GomberOIC Hansraj Landa; Akashdeep SabirMr. Mehtani; Harssh A. SinghJaswant; Aditya NandaKabir,0,0,0,0,0,0,0,0,1,0,0,1,0,0,0,1,0,0,0
Bullet Train (2022),126,74,Brad PittLadybug; Joey KingPrince; Aaron Taylor-JohnsonTangerine; Brian Tyree HenryLemon; Andrew KojiKimura; Hiroyuki SanadaThe Elder; Michael ShannonWhite Death,0,0,0,0,0,0,0,0,0,0,0,0,1,0,0,1,0,0,1
Whiplash (2014),107,84,Miles TellerAndrew; J.K. SimmonsFletcher; Paul ReiserJim; Melissa BenoistNicole; Austin StowellRyan; Nate LangCarl; Chris MulkeyUncle Frank,0,0,1,0,0,0,0,0,1,0,0,0,0,0,0,0,0,0,0
Operation Undead (2024),110,34,Chanon SantinatornkulMek; Awat RatanapinthaMok; Guntapat Kasemsan Na AyudhyaLukkai; Thawatchanin DarayonPhrao; Thanadol AuepongSak; Tanakorn TiyanontCherd; Tanatwut RodpaiInn,0,0,0,0,0,0,1,0,0,0,0,0,0,0,0,1,0,0,1
A Royal Date for Christmas (2023),84,57,Danica McKellarBella Sparks; Damon RunyanStefan; Patrice GoodmanMeridith; Vickie PapavsConnie; Nigel HamerBenjamin; Scott Ryan YamamuraJeff; Chris FarquharPhillip,0,0,0,1,0,0,0,1,0,0,0,0,1,0,0,0,0,0,0
Men in Black: International (2019),115,59,Chris HemsworthHenry / Agent H; Tessa ThompsonMolly Wright / Agent M; Rebecca FergusonRiza Stavros; Kumail NanjianiPawny (voice); Rafe SpallAgent C; Laurent BourgeoisAlien Twin #1; Larry BourgeoisAlien Twin #2,0,0,0,0,0,0,0,0,0,0,0,0,1,0,0,0,0,1,1
Cruel Intentions (1999),98,68,Ryan PhillippeSébastian Valmont; Sarah Michelle GellarKathryn Merteuil; Reese WitherspoonAnnette Hargrove; Selma BlairCecile Caldwell; Louise FletcherHelen Rosemond; Joshua JacksonBlaine Tuttle; Eric MabiusGreg McConnell,0,0,0,0,0,0,0,1,1,0,0,0,0,0,0,0,0,0,0
GoodFellas (1990),145,85,Robert De NiroJames Conway; Ray LiottaHenry Hill; Joe PesciTommy DeVito; Lorraine BraccoKaren Hill; Paul SorvinoPaul Cicero; Frank SiveroFrankie Carbone; Tony DarrowSonny Bunz,0,0,0,0,0,0,0,0,1,0,0,1,0,0,0,0,0,0,0
King of Killers (2023),91,66,Alain MoussiMarcus Garan; Frank GrilloJorg Drakos; Marie AvgeropoulosAsha Khanna; Georges St-PierreAndre Lecroix; Shannon KookRen Hiro; Kevin GreviouxDyson Chord; Ryan TarranRick Nigel,0,0,0,0,0,0,0,0,0,0,0,0,0,0,0,1,0,0,1
Star Wars: The Last Jedi (2017),152,68,Mark HamillLuke Skywalker / Dobbu Scay (voice); Carrie FisherLeia Organa; Adam DriverKylo Ren; Daisy RidleyRey; John BoyegaFinn; Oscar IsaacPoe Dameron; Andy SerkisSnoke,0,0,0,0,0,0,0,0,0,0,0,0,0,0,0,0,1,1,1
Cinderella (1950),74,70,Ilene WoodsCinderella (voice); Eleanor AudleyLady Tremaine (voice); Verna FeltonFairy Godmother (voice); Claire Du Brey(credit only) (voice); Rhoda WilliamsDrizella (voice); James MacDonaldGus / Jaq (voice); Helene Stanley(credit only),0,0,0,0,0,0,0,1,0,0,1,0,0,1,1,0,0,0,0
All Things Fair (1995),125,65,Johan WiderbergStig; Marika LagercrantzViola; Tomas von BrömssenKjell; Karin HuldtLisbet; Nina GunkeStig's Mother; Kenneth MilldoffStig's Father; Björn KjellmanSigge,0,0,0,0,1,0,0,1,1,0,0,0,0,0,0,0,0,0,0
The Girl Next Door (2004),110,67,Emile HirschMatthew Kidman; Elisha CuthbertDanielle; Timothy OlyphantKelly; Christopher MarquetteEli; Paul DanoKlitz; James RemarHugo Posh; Timothy BottomsMr. Kidman,0,0,0,0,0,0,0,1,0,0,0,0,1,0,0,0,0,0,0
Lucy (2014),89,65,Scarlett JohanssonLucy Miller; Morgan FreemanProfessor Samuel Norman; Choi Min-sikMr. Jang; Amr WakedPierre Del Rio; Julian Rhind-TuttThe Limey; Pilou AsbækRichard; Lio TiptonCaroline,0,0,0,0,0,0,0,0,0,0,0,0,0,0,0,0,0,1,1
The Exorcist (1973),122,77,Ellen BurstynChris MacNeil; Linda BlairRegan MacNeil; Jason MillerFather Damien Karras; Max von SydowFather Lankester Merrin; Lee J. CobbLt. Bill Kinderman; William O'MalleyFather Joseph Kevin Dyer; Kitty WinnSharon Spencer,0,0,0,0,0,0,1,0,1,0,0,0,0,0,0,0,0,0,0
Baywatch (2017),116,61,Dwayne JohnsonMitch Buchanan; Zac EfronMatt Brody; Priyanka Chopra JonasVictoria Leeds; Alexandra DaddarioSummer Quinn; Kelly RohrbachCJ Parker; Ilfenesh HaderaStephanie Holden; Jon BassRonnie Greenbaum,0,0,0,0,0,0,0,0,0,0,0,1,1,0,0,0,0,0,1
The Hunger Games: The Ballad of Songbirds & Snakes (2023),157,71,Tom BlythCoriolanus Snow; Rachel ZeglerLucy Gray Baird; Peter DinklageDean Casca Highbottom; Viola DavisDr. Volumnia Gaul; Josh RiveraSejanus Plinth; Dexter Sol AnsellYoung Coriolanus; Rosa GotzlerYoung Tigris,0,0,0,0,0,0,0,0,1,0,0,0,0,0,0,0,0,1,1
Evil Dead Rise (2023),96,69,Lily SullivanBeth; Alyssa SutherlandEllie; Morgan DaviesDanny; Gabrielle EcholsBridget; Nell FisherKassie; Mark MitchinsonMr. Fonda; Jayden DanielsGabriel,0,0,0,0,0,0,1,0,0,0,0,0,0,0,0,1,0,0,0
Arthur Christmas (2011),97,68,James McAvoyArthur (voice); Hugh LaurieSteve (voice); Bill NighyGrandsanta (voice); Jim BroadbentSanta (voice); Imelda StauntonMrs Santa (voice); Ashley JensenBryony (voice); Marc WoottonPeter (voice),0,0,0,0,0,0,0,0,1,0,0,0,1,1,1,0,0,0,0
Private School (1983),89,57,Phoebe CatesChristine Ramsey; Betsy RussellJordan Leigh-Jenson; Matthew ModineJim Green; Michael ZorekBubba Beauregard; Fran RyanMiss Dutchbok; Kathleen WilhoiteBetsy; Ray WalstonChauncey,0,0,0,0,0,0,0,1,0,0,0,0,1,0,0,0,0,0,0
The Twilight Saga: Breaking Dawn - Part 1 (2011),117,62,Kristen StewartBella Swan; Robert PattinsonEdward Cullen; Taylor LautnerJacob Black; Billy BurkeCharlie Swan; Peter FacinelliDr. Carlisle Cullen; Michael SheenAro; Elizabeth ReaserEsme Cullen,0,0,0,0,0,0,0,1,0,0,1,0,0,0,0,0,1,0,0
Highlander: The Search for Vengeance (2007),86,72,Alistair AbellColin MacLeod (voice); Debi Mae WestDahlia (voice); Nolan NorthMarcus Octavius (voice); Scott McNeilAmergan / Gregor / Lad Director (voice); Ogie BanksJoe (voice); Janyse JaudKyala (voice); Jim ByrnesDoc / Rudy (voice),0,0,0,0,0,0,0,0,0,0,1,0,0,0,1,0,0,1,1
Scream 4 (2011),111,65,David ArquetteDewey Riley; Neve CampbellSidney Prescott; Courteney CoxGale Weathers-Riley; Emma RobertsJill Roberts; Hayden PanettiereKirby Reed; Anthony AndersonDeputy Perkins; Adam BrodyDeputy Hoss,0,0,0,0,0,0,1,0,0,1,0,0,0,0,0,0,0,0,0
Bedspacer (2024),106,44,Christine BermasJanice; Micaella RazLexi/Jennifer; Matthew FranciscoSecurity Guard; JD AguasRyan; Rash FloresGio; Aila CruzSasha; Aria BenchAndrea,0,0,0,0,0,0,0,0,1,0,0,0,0,0,0,1,0,0,0
Burning Betrayal (2023),99,62,Giovanna LancellottiBárbara 'Babi' Nucci; Leandro LimaMarco Ladeia; Camilla de LucasPatrícia 'Patty' Alencar Rochetty; Bruno MontaleoneThiago; Micael BorgesCaio Laruzi Sampaio; Louise D'TuaniPaula Góes Mesquita; Drayson MenezzesAlexandre,0,0,0,0,0,0,0,1,1,1,0,0,0,0,0,0,0,0,0
The Tearsmith (2024),106,65,Caterina FerioliNica; Simone BaldasseroniRigel Wilde; Sabrina ParaviciniMargaret; Alessandro BedettiLionel; Roberta RovelliAnna Milligan; Orlando CinqueNorman Milligan; Eco Andriolo RanziAdeline,0,0,0,0,0,0,0,1,1,0,0,0,0,0,0,0,0,0,0
Afraid (2024),84,60,John ChoCurtis; Katherine WaterstonMeredith; Keith CarradineMarcus; Havana Rose LiuMelody / AIA (voice); Lukita MaxwellIris; Ashley RomansSam; David DastmalchianLightning,0,0,0,0,0,0,1,0,0,0,0,0,0,0,0,1,0,1,0
He's Just Not That Into You (2009),129,66,Ginnifer GoodwinGigi Phillips; Justin LongAlex; Bradley CooperBen Gunders; Jennifer ConnellyJanine Gunders; Jennifer AnistonBeth Murphy; Ben AffleckNeil; Scarlett JohanssonAnna Marks,0,0,0,0,0,0,0,1,1,0,0,0,1,0,0,0,0,0,0
WALL·E (2008),98,81,"Ben BurttWALL·E / M-O (voice); Elissa KnightEVE (voice); Jeff GarlinCaptain (voice); Fred WillardShelby Forthright, BnL CEO; John RatzenbergerJohn (voice); Kathy NajimyMary (voice); Sigourney WeaverShip's Computer (voice)",0,0,0,0,0,0,0,0,0,0,0,0,0,1,1,0,0,1,0
No Time to Die (2021),163,74,Daniel CraigJames Bond; Léa SeydouxMadeleine; Rami MalekLyutsifer Safin; Lashana LynchNomi; Ralph FiennesM; Ben WhishawQ; Naomie HarrisMoneypenny,0,0,0,0,0,0,0,0,0,0,0,0,0,0,0,1,1,0,1
Blended (2014),117,69,Adam SandlerJim; Drew BarrymoreLauren; Kevin NealonEddy; Terry CrewsNickens; Wendi McLendon-CoveyJen; Bella ThorneHilary; Joel McHaleMark,0,0,0,0,0,0,0,1,0,0,0,0,1,0,0,0,0,0,0
One Piece Film Red (2022),115,72,Mayumi TanakaMonkey D. Luffy (voice); Kazuya NakaiRoronoa Zoro (voice); Shuichi IkedaShanks (voice); Kaori NazukaUta (voice); Akemi OkamuraNami (voice); Kappei YamaguchiUsopp (voice); Hiroaki HirataSanji (voice),0,0,1,0,0,0,0,0,0,0,1,0,0,0,1,0,1,0,1
The Day of the Jackal (1973),143,75,Edward FoxThe Jackal; Terence AlexanderLloyd; Michel AuclairColonel Rolland; Alan Badelthe Minister; Tony BrittonInspector Thomas; Denis CareyCasson; Cyril CusackGunsmith,0,0,0,0,0,0,0,0,0,0,0,0,0,0,0,1,0,0,1
The Parent Trap (1998),128,72,"Lindsay LohanHallie Parker / Annie James; Dennis QuaidNick Parker; Natasha RichardsonElizabeth James; Elaine HendrixMeredith Blake; Lisa Ann WalterChessy; Simon KunzMartin; Polly HollidayMarva Kulp, Sr.",0,0,0,0,0,0,0,1,0,0,0,0,1,1,0,0,0,0,0
Logan (2017),137,78,Hugh JackmanLogan / Wolverine / X-24; Dafne KeenLaura Kinney / X-23; Patrick StewartCharles Xavier / Professor X; Elizabeth RodriguezGabriela; Boyd HolbrookPierce; Stephen MerchantCaliban; Richard E. GrantDr. Zander Rice,0,0,0,0,0,0,0,0,1,0,0,0,0,0,0,0,0,1,1
Men in Black (1997),98,72,Tommy Lee JonesKay; Will SmithJay; Linda FiorentinoLaurel; Vincent D'OnofrioEdgar; Rip TornZed; Tony ShalhoubJeebs; Siobhan Fallon HoganBeatrice,0,0,0,0,0,0,0,0,0,0,0,0,1,0,0,0,1,1,1
Pirates of the Caribbean: At World's End (2007),169,73,"Johnny DeppJack Sparrow; Orlando BloomWill Turner; Keira KnightleyElizabeth Swann; Geoffrey RushHector Barbossa; Stellan SkarsgårdWilliam ""Bootstrap Bill"" Turner; Chow Yun-FatSao Feng; Bill NighyDavy Jones",0,0,0,0,0,0,0,0,0,0,1,0,0,0,0,0,1,0,1
Madagascar 3: Europe's Most Wanted (2012),93,66,Ben StillerAlex (voice); Chris RockMarty (voice); David SchwimmerMelman (voice); Jada Pinkett SmithGloria (voice); Frances McDormandCaptain Chantel DuBois (voice); Sacha Baron CohenJulien (voice); Andy RichterMort (voice),0,0,0,0,0,0,0,0,0,0,0,0,1,1,1,0,1,0,0
Leo (2023),102,75,Adam SandlerLeo (voice); Bill BurrSquirtle (voice); Cecily StrongMrs. Malkin (voice); Jason AlexanderJayda's Dad (voice); Rob SchneiderPrincipal (voice); Allison StrongMrs. Salinas (voice); Jo KoyCoach Kimura (voice),0,0,0,0,0,0,0,0,0,0,0,0,1,1,1,0,0,0,0
The Gigolo (2015),97,51,Dominic HoFung; Candy YuenMichelle; Jeana Ho Pui-YuChloe; Hazel TongYoyo; Winnie Leung Man-YeeBelle; Pal Sinn Lap-ManAbson; Angelina Lo Yuen-YanFung's Mother,0,0,0,0,0,0,0,1,1,0,0,0,1,0,0,0,0,0,0
The Purge: Anarchy (2014),103,66,Frank GrilloSergeant; Carmen EjogoEva Sanchez; Zach GilfordShane; Michael Kenneth WilliamsCarmelo; Kiele SanchezLiz; Zoë SoulCali; Edwin HodgeThe Stranger,0,0,0,0,0,0,1,0,0,0,0,0,0,0,0,1,0,0,0
Queen of Hearts (2019),127,69,Trine DyrholmAnne; Gustav LindhGustav; Magnus KrepperPeter; Liv Esmår DannemannFrida; Silja Esmår DannemannFanny; Stine GyldenkerneLina; Preben KristensenErik,0,0,0,0,0,0,0,0,1,0,0,0,0,0,0,0,0,0,0
Ghostbusters: Frozen Empire (2024),115,65,Mckenna GracePhoebe Spengler; Paul RuddGary Grooberson; Carrie CoonCallie Spengler; Finn WolfhardTrevor Spengler; Dan AykroydRay Stantz; Kumail NanjianiNadeem; Patton OswaltDr. Hubert Wartzki,0,0,0,0,0,0,0,0,0,0,1,0,1,0,0,0,1,0,0
The Terminator (1984),108,77,Arnold SchwarzeneggerTerminator; Michael BiehnKyle Reese; Linda HamiltonSarah Connor; Paul WinfieldTraxler; Lance HenriksenVukovich; Rick RossovichMatt; Bess MottaGinger,0,0,0,0,0,0,0,0,0,0,0,0,0,0,0,1,0,1,1
The Twilight Saga: Eclipse (2010),124,62,Kristen StewartBella Swan; Robert PattinsonEdward Cullen; Taylor LautnerJacob Black; Bryce Dallas HowardVictoria; Dakota FanningJane; Billy BurkeCharlie Swan; Peter FacinelliDr. Carlisle Cullen,0,0,0,0,0,0,0,1,1,0,1,0,0,0,0,0,1,0,0
Hit Man (2024),116,69,Glen PowellGary Johnson; Adria ArjonaMadison Figueroa Masters; Austin AmelioJasper; RettaClaudette; Sanjay RaoPhil; Molly BernardAlicia; Evan HoltzmanRay,0,0,0,0,0,0,0,1,0,0,0,1,1,0,0,0,0,0,0
PAW Patrol: The Mighty Movie (2023),92,70,Mckenna GraceSkye (voice); Christian ConveryChase (voice); Taraji P. HensonVictoria Vance (voice); Kristen BellJanet (voice); Lil Rel HowerySam Stinger (voice); James MarsdenHank (voice); Finn Lee-EppRyder (voice),0,0,0,0,0,0,0,0,1,0,0,0,1,1,1,0,1,1,1
How the Grinch Stole Christmas! (1966),26,75,Boris KarloffNarrator / The Grinch (voice); June ForayCindy Lou Who (voice) (uncredited); Dal McKennonMax (voice) (uncredited); Thurl RavenscroftSinger of You're A Mean One Mr. Grinch (voice) (uncredited); ,0,0,0,0,0,0,0,0,0,0,0,0,1,1,1,0,0,0,0
Dungeons & Dragons: Honor Among Thieves (2023),134,73,Chris PineEdgin; Michelle RodriguezHolga; Justice SmithSimon; Sophia LillisDoric; Hugh GrantForge; Regé-Jean PageXenk; Chloe ColemanKira,0,0,0,0,0,0,0,0,0,0,1,0,1,0,0,0,1,0,0
Pearl Harbor (2001),183,69,Ben AffleckRafe McCawley; Kate BeckinsaleEvelyn Johnson; Josh HartnettDanny Walker; Cuba Gooding Jr.Doris Miller; Jon VoightFranklin D. Roosevelt; Tom SizemoreEarl Sistern; Alec BaldwinJames Doolittle,0,0,0,0,1,1,0,1,1,0,0,0,0,0,0,0,0,0,1
Despicable Me (2010),95,72,Steve CarellGru (voice); Jason SegelVector (voice); Miranda CosgroveMargo (voice); Elsie FisherAgnes (voice); Dana GaierEdith (voice); Russell BrandDr. Nefario (voice); Julie AndrewsGru's Mother (voice),0,0,0,0,0,0,0,0,0,0,0,0,1,1,1,0,0,0,0
The First Omen (2024),119,69,Nell Tiger FreeMargaret; Ralph InesonFather Brennan; Sônia BragaSister Silva; Tawfeek BarhomFather Gabriel; María CaballeroLuz; Charles DanceFather Harris; Bill NighyCardinal Lawrence,0,0,0,0,0,0,1,0,0,0,0,0,0,0,0,0,0,0,0
After Ever Happy (2022),95,68,"Josephine LangfordTessa Young; Hero Fiennes TiffinHardin Scott; Louise LombardTrish Daniels; Chance PerdomoLandon Gibson; Rob EstesKen Scott; Arielle KebbelKimberly ""Kim"" Vance; Stephen MoyerChristian Vance",0,0,0,0,0,0,0,1,1,0,0,0,0,0,0,0,0,0,0
American Psycho (2000),102,74,Christian BalePatrick Bateman; Justin TherouxTimothy Bryce; Josh LucasCraig McDermott; Bill SageDavid Van Patten; Chloë SevignyJean; Reese WitherspoonEvelyn Williams; Samantha MathisCourtney Rawlinson,0,0,0,0,0,0,0,0,1,0,0,1,0,0,0,1,0,0,0
The Mask (1994),101,70,Jim CarreyStanley Ipkiss / The Mask; Peter GreeneDorian Tyrrell; Cameron DiazTina Carlyle; Amy YasbeckPeggy Brandt; Peter RiegertLieutenant Mitch Kellaway; Richard JeniCharlie Schumaker; Orestes MatacenaNiko,0,0,0,0,0,0,0,1,0,0,1,1,1,0,0,0,0,0,0
Scream (2022),114,67,Melissa BarreraSam Carpenter; Jenna OrtegaTara Carpenter; Mason GoodingChad Meeks-Martin; Jasmin Savoy BrownMindy Meeks-Martin; Jack QuaidRichie Kirsch; Mikey MadisonAmber Freeman; Courteney CoxGale Weathers,0,0,0,0,0,0,1,0,0,1,0,0,0,0,0,1,0,0,0
Maze Runner: The Death Cure (2018),143,71,Dylan O'BrienThomas; Kaya ScodelarioTeresa Agnes; Thomas Brodie-SangsterNewt; Ki Hong LeeMinho; Dexter DardenFrypan; Rosa SalazarBrenda; Giancarlo EspositoJorge,0,0,0,0,0,0,0,0,0,0,0,0,0,0,0,1,1,1,1
Home Alone 3 (1997),102,53,Alex D. LinzAlex Pruitt; Olek KrupaPeter Beaupre; Rya KihlstedtAlice Ribbons; Lenny Von DohlenBurton Jernigan; David ThorntonEarl Unger; Haviland MorrisKaren Pruitt; Kevin KilnerJack Pruitt,0,0,0,0,0,0,0,0,0,0,0,0,1,1,0,0,0,0,0
Meet Me Next Christmas (2024),105,63,Christina MilianLayla; Devale EllisTeddy; Kofi SiriboeJames; Kalen AllenJordy; Mitch GrassiMitch; Scott HoyingScott; Kirstin MaldonadoKirstin,0,0,0,0,0,0,0,1,0,0,0,0,1,0,0,0,0,0,0
Autumn and the Black Jaguar (2024),100,66,Lumi PollackAutumn Edison; Emily Bett RickardsAnja; Wayne Charles BakerOré; Paul GreeneSaul Edison; Kelly Hope TaylorDoria Dargan; Lucrezia PiniCelya; Letitia BrookesNYC Airport Ground Staff Hostess,0,0,0,0,0,0,0,0,0,0,0,0,0,1,0,0,1,0,0
Horizon: An American Saga - Chapter 1 (2024),182,70,"Kevin CostnerHayes Ellison; Sienna MillerFrances Kittredge; Sam WorthingtonTrent Gephart; Jena Malone""Ellen"" Harvey; Abbey LeeMarigold; Michael RookerSgt. Major Thomas Riordan; Danny HustonCol. Albert Houghton",1,0,0,0,0,0,0,0,1,0,0,0,0,0,0,0,0,0,0
Insurgent (2015),119,64,Shailene WoodleyBeatrice 'Tris' Prior; Theo JamesTobias 'Four' Eaton; Miles TellerPeter Hayes; Kate WinsletJeanine Matthews; Ansel ElgortCaleb Prior; Zoë KravitzChristina; Jai CourtneyEric Coulter,0,0,0,0,0,0,0,0,0,0,0,0,0,0,0,1,0,1,1
The Nun II (2023),110,67,Taissa FarmigaSister Irene; Jonas BloquetMaurice Theriault; Storm ReidSister Debra; Anna PopplewellKate; Bonnie AaronsThe Demon Nun / Valak; Katelyn Rose DowneySophie; Suzanne BertishMadame Laurent,0,0,0,0,0,0,1,0,0,0,0,0,0,0,0,0,0,0,0
Deadpool 2 (2018),120,75,Ryan ReynoldsWade Wilson / Deadpool / Juggernaut (voice); Josh BrolinCable; Morena BaccarinVanessa; Julian DennisonFirefist; Zazie BeetzDomino; T.J. MillerWeasel; Leslie UggamsBlind Al,0,0,0,0,0,0,0,0,0,0,0,0,1,0,0,0,1,0,1
Schindler's List (1993),195,86,Liam NeesonOskar Schindler; Ben KingsleyItzhak Stern; Ralph FiennesAmon Goeth; Caroline GoodallEmilie Schindler; Jonathan SagallPoldek Pfefferberg; Embeth DavidtzHelen Hirsch; Malgorzata GebelViktoria Klonowska,0,0,0,0,1,1,0,0,1,0,0,0,0,0,0,0,0,0,0
Linda (2024),100,72,Eugenia SuárezLinda; Rafael SpregelburdCamilo; Julieta CardinaliLuisa; Minerva CaseroMatilda; Felipe OtañoCeferino; Agustín Della CorteBlas; ,0,0,0,0,0,0,0,0,1,0,0,0,0,0,0,0,0,0,0
Jujutsu Kaisen 0 (2021),105,82,Megumi OgataYuta Okkotsu (voice); Kana HanazawaRika Orimoto (voice); Yuichi NakamuraSatoru Gojo (voice); Takahiro SakuraiSuguru Geto (voice); Mikako KomatsuMaki Zen'in (voice); Koki UchiyamaToge Inumaki (voice); Tomokazu SekiPanda (voice),0,0,0,0,0,0,0,0,0,0,1,0,0,0,1,0,0,0,1
Blue Beetle (2023),128,67,Xolo MariduenaJaime Reyes / Blue Beetle; Bruna MarquezineJenny Kord; Susan SarandonVictoria Kord; Raoul Max TrujilloCarapax; Belissa EscobedoMilagros Reyes; Damián AlcázarAlberto Reyes; Elpidia CarrilloRocío Reyes,0,0,0,0,0,0,0,0,0,0,0,0,0,0,0,0,1,1,1
The Roundup: No Way Out (2023),105,72,Ma Dong-seokMa Seok-do; Lee Jun-hyukJoo Seong-cheol; Munetaka AokiRiki; Lee Beom-sooJang Tae-su; Kim Min-jaeKim Man-jae; Lee Ji-hoonYang Jong-su; Kim Do-gunJung Da-wit,0,0,0,0,0,0,0,0,0,0,0,1,1,0,0,1,0,0,1
The Suicide Squad (2021),132,75,Margot RobbieHarley Quinn; Idris ElbaBloodsport; John CenaPeacemaker; Joel KinnamanColonel Rick Flag; Sylvester StalloneKing Shark (voice); Viola DavisAmanda Waller; David DastmalchianPolka-Dot Man,0,0,0,0,0,0,0,0,0,0,0,0,1,0,0,0,1,0,1
Iron Man (2008),126,76,Robert Downey Jr.Tony Stark; Terrence HowardRhodey; Jeff BridgesObadiah Stane; Gwyneth PaltrowPepper Potts; Leslie BibbChristine Everhart; Shaun ToubYinsen; Faran TahirRaza,0,0,0,0,0,0,0,0,0,0,0,0,0,0,0,0,1,1,1
Cinderella (2015),105,68,"Lily JamesCinderella; Cate BlanchettStepmother, Lady Tremaine; Richard MaddenPrince; Stellan SkarsgårdGrand Duke; Holliday GraingerAnastasia Tremaine; Sophie McSheraDrizella Tremaine; Derek JacobiKing",0,0,0,0,0,0,0,1,1,0,1,0,0,1,0,0,0,0,0
Godzilla (2014),123,63,Aaron Taylor-JohnsonFord Brody; Elizabeth OlsenElle Brody; Juliette BinocheSandra Brody; Bryan CranstonJoe Brody; Ken WatanabeDr. Ishiro Serizawa; Sally HawkinsDr. Vivienne Graham; Al SapienzaHuddleston,0,0,0,0,0,0,0,0,1,0,0,0,0,0,0,0,0,1,1
Love Actually (2003),135,71,Hugh GrantThe Prime Minister; Alan RickmanHarry; Emma ThompsonKaren; Liam NeesonDaniel; Martine McCutcheonNatalie; Colin FirthJamie Bennett; Bill NighyBilly Mack,0,0,0,0,0,0,0,1,1,0,0,0,1,0,0,0,0,0,0
